{
  "id": "PRJ-002",
  "companyId": "COMPANY-001",
  "branchId": "BRANCH-001",
  "customerId": "CUST-002",
  "title": "Kindergarten Lemgo",
  "siteName": "Kindergarten Lemgo",
  "siteStreet": "Schulstraße 4",
  "siteZip": "32657",
  "siteCity": "Lemgo",
  "trade": "Sanitär",
  "status": "commissioned",
  "startDate": "2026-01-15",
  "foremanEmployeeId": "EMP-010",
  "timelineDocumentIds": [],
  "notes": "TestWorld-Projekt 01C – noch ohne Dokumente",
  "endDate": "2026-08-31"
}
